{
  "schemaVersion": 1,
  "publication": {
    "name": "AI Signal",
    "subtitle": "What changed. Why it matters. Where it’s going.",
    "edition": "16",
    "mode": "live",
    "updatedAt": "2026-10-15"
  },
  "analytics": {
    "provider": "cloudflare-web-analytics",
    "enabled": true,
    "siteToken": "fa818fb8086c4dda9df4e038108ffd06"
  },
  "stories": [
    {
      "id": "the-workflow-got-a-lockfile",
      "slug": "the-workflow-got-a-lockfile",
      "title": "The workflow got a lockfile.",
      "summary": "GitHub Actions can now keep readable tags and branches in workflow files while executing the exact commits recorded in a dependency lockfile. The useful signal is bigger than a new CLI: CI dependencies are becoming a reviewable graph with runtime enforcement and organization-level policy.",
      "topic": "Reproducible GitHub Actions dependencies",
      "category": "Security & Governance",
      "signal": "Important",
      "status": "published",
      "featured": true,
      "publishedAt": "2026-10-14",
      "updatedAt": "2026-10-15",
      "author": "Dugi Selmanaj",
      "visual": "security",
      "scenario": "GitHub introduced public-preview workflow dependency lockfiles, a CLI extension, Dependabot integration, and an enforceable policy for keeping Actions runs tied to reviewed commits.",
      "facts": [
        {
          "text": "GitHub published the workflow dependency lockfile public preview on 14 October 2026 for GitHub Enterprise Cloud, Enterprise Cloud with data residency, Team, and Free plans.",
          "sourceIds": [
            "github-actions-lockfiles-preview"
          ],
          "verifiedAt": "2026-10-15"
        },
        {
          "text": "The gh actions-lock extension generates .github/workflows/actions.lock with commits for direct and transitive action dependencies and reusable workflow dependencies.",
          "sourceIds": [
            "github-actions-lockfiles-preview"
          ],
          "verifiedAt": "2026-10-15"
        },
        {
          "text": "An onboarded workflow must have lockfile entries for its dependencies, and GitHub Actions uses the recorded commits even when a referenced tag or branch moves.",
          "sourceIds": [
            "github-actions-lockfiles-preview"
          ],
          "verifiedAt": "2026-10-15"
        },
        {
          "text": "The extension can verify in CI that the lockfile remains current without modifying repository files.",
          "sourceIds": [
            "github-actions-lockfiles-preview"
          ],
          "verifiedAt": "2026-10-15"
        },
        {
          "text": "GitHub says Dependabot regenerates the matching lockfile entry when it opens an update for an action in an already onboarded workflow.",
          "sourceIds": [
            "github-actions-lockfiles-preview"
          ],
          "verifiedAt": "2026-10-15"
        },
        {
          "text": "A Require lockfile policy is available in public preview for administrators to apply at enterprise, organization, or repository scope.",
          "sourceIds": [
            "github-actions-lockfiles-preview"
          ],
          "verifiedAt": "2026-10-15"
        },
        {
          "text": "GitHub explicitly says locking does not determine whether a dependency is safe and tells users to review dependencies before locking them.",
          "sourceIds": [
            "github-actions-lockfiles-preview"
          ],
          "verifiedAt": "2026-10-15"
        }
      ],
      "changed": "GitHub moved exact action pinning from a convention inside each workflow into a managed dependency graph. Teams can retain readable references, review the resolved commits, verify the graph in CI, update it with Dependabot, and require coverage through policy.",
      "whyItMatters": "A CI workflow executes privileged third-party code before the product artifact exists. A moving tag can therefore change the build without changing the repository under review. Lockfiles make that hidden dependency graph visible, reproducible, and enforceable across teams instead of relying on every author to remember full commit SHAs.",
      "technicalImpact": "Treat actions.lock as generated security evidence: create it with the supported CLI, require verification on pull requests, route changes to build-security reviewers, and keep updates paired with workflow changes. Roll out enforcement only after workflows are onboarded and update automation is reliable, because stale or missing entries can stop runs.",
      "businessImpact": "Platform and security teams gain a common control for reducing unexpected CI dependency drift and explaining which code ran during a build. The cost moves into review and maintenance: organizations need owners for lockfile changes, staged policy rollout, and a response when an upstream action is compromised or must be updated urgently.",
      "outlook": "Conditional outlook: if the preview proves reliable across large repositories and teams adopt review and update practices around it, workflow lockfiles could become the normal supply-chain boundary for hosted CI dependencies. If lockfiles create frequent friction, remain incomplete, or are approved without examining the resolved code, they will provide consistency without meaningful assurance.",
      "uncertainties": [
        "The capability and the Require lockfile policy are in public preview, so eligibility, behavior, and operational details can still change.",
        "A locked commit can contain vulnerable or malicious code; reproducibility is not a safety verdict.",
        "The announcement does not publish adoption data, blocked-attack counts, false-positive rates, or measured developer overhead.",
        "Dependabot maintains entries only for workflows already onboarded, so teams still need a process for new workflows and dependencies.",
        "Organization-wide enforcement can interrupt normal CI when lockfiles are stale, incomplete, or introduced before teams are ready.",
        "Review quality remains a human and process dependency: a changed SHA is useful evidence only when someone investigates it.",
        "The announcement establishes GitHub-hosted product behavior, not portability to other CI systems or a universal lockfile standard."
      ],
      "analysis": "Full-SHA pinning was already possible. The structural change is that GitHub is turning it into a dependency-management system: transitive resolution, verification, automated updates, and policy enforcement share one artifact. That closes a usability gap. It does not close the trust problem inside the commit.",
      "sources": [
        {
          "id": "github-actions-lockfiles-preview",
          "title": "GitHub Actions workflow lockfiles in public preview",
          "publisher": "GitHub",
          "url": "https://github.blog/changelog/2026-10-14-github-actions-workflow-lockfiles-in-public-preview/",
          "publishedAt": "2026-10-14",
          "accessedAt": "2026-10-15"
        }
      ],
      "sourceNote": "Primary product announcement from GitHub. Availability and behavior are vendor-described; the post supplies no adoption, attack-prevention, or developer-friction measurements and explicitly says locking does not establish dependency safety.",
      "review": {
        "status": "approved",
        "reviewer": "Dugi Selmanaj",
        "reviewedAt": "2026-10-15"
      }
    },
    {
      "id": "the-scam-detector-stayed-on-the-phone",
      "slug": "the-scam-detector-stayed-on-the-phone",
      "title": "The scam detector stayed on the phone.",
      "summary": "Google DeepMind and Singapore GovTech built a locally tuned scam-detection model intended to process conversations on users' devices. The useful signal is not a claimed detection score—the announcement gives none. It is a two-stage edge architecture that tries to improve safety without making private messages a cloud dataset.",
      "topic": "On-device, locally adapted AI safety",
      "category": "Security & Governance",
      "signal": "Interesting",
      "status": "published",
      "featured": false,
      "publishedAt": "2026-10-14",
      "updatedAt": "2026-10-15",
      "author": "Dugi Selmanaj",
      "visual": "security",
      "scenario": "Google DeepMind and Singapore GovTech described a privacy-oriented model and staged deployment plan for detecting locally specific scam conversations on typical smartphones.",
      "facts": [
        {
          "text": "Google DeepMind published the announcement on 14 October 2026 and said it built the model with Singapore's Government Technology Agency under their National AI Partnership.",
          "sourceIds": [
            "deepmind-on-device-scam-detection"
          ],
          "verifiedAt": "2026-10-14"
        },
        {
          "text": "The project fine-tuned a lightweight Gemma model on localized scam conversations covering impersonation of institutions, banks, public figures, and other regional schemes.",
          "sourceIds": [
            "deepmind-on-device-scam-detection"
          ],
          "verifiedAt": "2026-10-14"
        },
        {
          "text": "Google says the planned application integration will process conversation data entirely on-device and will require user consent before accessing on-device conversations.",
          "sourceIds": [
            "deepmind-on-device-scam-detection"
          ],
          "verifiedAt": "2026-10-14"
        },
        {
          "text": "The announced design uses a lightweight first-stage classifier to screen inbound messages and sends suspicious cases to a fine-tuned Gemma model for analysis of a larger multi-turn conversation snapshot.",
          "sourceIds": [
            "deepmind-on-device-scam-detection"
          ],
          "verifiedAt": "2026-10-14"
        },
        {